{"schema_version":"AIGC_EXECUTION_RECEIPT_V1","run_id":"aigc-local-execution-79183-1785477765590922000-87","result":"PASS","subject_identity":{"fixture_id":"AIGC_LOCAL_EXECUTION_FIXTURE_V1","fixture_sha256":"364b622ddbab77b6bf1c6e3749505d3521975004d417cfb737f8288043ac309f","input_tree_sha256":"a145cd294fe4db6eee4661c1b5919065a9966a9890733b2ab9aa5871bc1484aa","argv":["/usr/local/bin/node","/input/fixture.js","safe"]},"backend_identity":{"backend_id":"OCI_ZERO_EGRESS_V1","engine_endpoint":"unix:///Users/d/.colima/default/docker.sock","daemon_id":"957303c7-d656-40f0-b27c-200f0979ef6e","architecture":"aarch64","engine_version":"29.5.2","runtime_version":"1.3.5","kernel_version":"6.8.0-117-generic","image_id":"sha256:644afe5be5946300fc629dcdd407cb7cc1942f5c1dc15a0b6014f7fc5d9e4cf3","enforcement_profile_sha256":"469aba1bbbdbee368009505ac6aff7f56b930ada01ff247246ef7e050d029342","controller_build":"0.1.0","controller_executable_sha256":"881c382e45cd42890baff971a7b7463331be1f94e0cd1803b81b01da59215f34"},"requested_policy":{"schema_version":"AIGC_EXECUTION_POLICY_V1","policy_id":"AIGC_OCI_ZERO_EGRESS_POLICY_V1","backend_id":"OCI_ZERO_EGRESS_V1","input_tree_sha256":"a145cd294fe4db6eee4661c1b5919065a9966a9890733b2ab9aa5871bc1484aa","image_id":"sha256:644afe5be5946300fc629dcdd407cb7cc1942f5c1dc15a0b6014f7fc5d9e4cf3","argv":["/usr/local/bin/node","/input/fixture.js","safe"],"working_directory":"/workspace","filesystem":{"immutable_input_path":"/input","writable_workspace_path":"/workspace","output_path_allowlist":["allowed.txt"],"max_output_bytes":8192,"host_mounts_allowed":false},"network":{"mode":"DENY_ALL","blocked_classes":["DNS","IPV4","IPV6","METADATA","LOOPBACK","UNIX_SOCKET","PROXY"]},"process":{"child_processes_allowed":true,"pid_limit":16,"wall_time_ms":15000,"controller_death_cleanup_required":true,"trusted_init_required":true},"resources":{"memory_bytes":268435456,"memory_swap_bytes":268435456,"cpu_quota_millis":500,"workspace_bytes":67108864,"max_file_bytes":8388608,"max_open_files":64},"environment":{"allowed_keys":["HOME","HOSTNAME","LANG","NODE_VERSION","PATH","TMPDIR","YARN_VERSION"],"secrets":"NONE","synthetic_home":"/workspace/home","synthetic_tmp":"/tmp"},"export":{"patch_only":true,"review_required":true,"reviewer_kind":"DETERMINISTIC_FIXTURE_REVIEWER_V1","max_patch_bytes":8192},"evidence":{"required_control_ids":["BACKEND-NEGATIVE-EXACT-REQUEST","CLEANUP-NEGATIVE-ZERO-RESIDUE","CLEANUP-POSITIVE-EXACT-REMOVAL","CLEANUP-VULNERABLE-RESIDUE-SENSOR","ENV-NEGATIVE-SYNTHETIC","EVIDENCE-NEGATIVE-SIMULATION-REJECTED","EVIDENCE-POSITIVE-TRUSTED-SENSOR","EVIDENCE-VULNERABLE-SIMULATION-PROBE","EXPORT-NEGATIVE-SMUGGLING","EXPORT-NEGATIVE-TOCTOU","EXPORT-POSITIVE-REVIEW","EXPORT-VULNERABLE-NAIVE-ACCEPTANCE","FS-NEGATIVE-BOUNDARY","FS-POSITIVE-ALLOWED-WRITE","FS-VULNERABLE-OUTSIDE-WRITE","NETWORK-NEGATIVE-ZERO-EGRESS","NETWORK-POSITIVE-RUN-OWNED-SENSORS","NETWORK-VULNERABLE-SOCKETS","PROCESS-NEGATIVE-CONTROLLER-DEATH","PROCESS-NEGATIVE-TIMEOUT","PROCESS-POSITIVE-CHILD","PROCESS-VULNERABLE-DELAYED-CHILD"],"require_effective_policy_readback":true,"require_zero_residue":true,"maximum_claim":"A deterministic synthetic fixture ran under the exact recorded OCI engine, image, effective configuration, socket-denial profile, controls, export review, and cleanup evidence."}},"effective_policy":{"readback_complete":true,"image_id":"sha256:644afe5be5946300fc629dcdd407cb7cc1942f5c1dc15a0b6014f7fc5d9e4cf3","enforcement_profile_sha256":"469aba1bbbdbee368009505ac6aff7f56b930ada01ff247246ef7e050d029342","seccomp_architectures":["SCMP_ARCH_AARCH64","SCMP_ARCH_ARM"],"argv":["/usr/local/bin/node","/input/fixture.js","safe"],"working_directory":"/workspace","user":"65534:65534","network_mode":"none","readonly_root":true,"mount_count":0,"host_mount_count":0,"host_config_mount_count":0,"runtime_mount_count":0,"cap_drop":["ALL"],"security_options":["no-new-privileges","seccomp={\"defaultAction\":\"SCMP_ACT_ERRNO\",\"defaultErrnoRet\":1,\"archMap\":[{\"architecture\":\"SCMP_ARCH_AARCH64\",\"subArchitectures\":[\"SCMP_ARCH_ARM\"]}],\"syscalls\":[{\"names\":[\"accept\",\"accept4\",\"access\",\"adjtimex\",\"alarm\",\"bind\",\"brk\",\"cachestat\",\"capget\",\"capset\",\"chdir\",\"chmod\",\"chown\",\"chown32\",\"clock_adjtime\",\"clock_adjtime64\",\"clock_getres\",\"clock_getres_time64\",\"clock_gettime\",\"clock_gettime64\",\"clock_nanosleep\",\"clock_nanosleep_time64\",\"close\",\"close_range\",\"connect\",\"copy_file_range\",\"creat\",\"dup\",\"dup2\",\"dup3\",\"epoll_create\",\"epoll_create1\",\"epoll_ctl\",\"epoll_pwait\",\"epoll_pwait2\",\"epoll_wait\",\"eventfd\",\"eventfd2\",\"execve\",\"execveat\",\"exit\",\"exit_group\",\"faccessat\",\"faccessat2\",\"fadvise64\",\"fadvise64_64\",\"fallocate\",\"fanotify_mark\",\"fchdir\",\"fchmod\",\"fchmodat\",\"fchmodat2\",\"fchown\",\"fchown32\",\"fchownat\",\"fcntl\",\"fcntl64\",\"fdatasync\",\"fgetxattr\",\"flistxattr\",\"flock\",\"fork\",\"fremovexattr\",\"fsetxattr\",\"fstat\",\"fstat64\",\"fstatat64\",\"fstatfs\",\"fstatfs64\",\"fsync\",\"ftruncate\",\"ftruncate64\",\"futex\",\"futex_requeue\",\"futex_time64\",\"futex_wait\",\"futex_waitv\",\"futex_wake\",\"futimesat\",\"getcpu\",\"getcwd\",\"getdents\",\"getdents64\",\"getegid\",\"getegid32\",\"geteuid\",\"geteuid32\",\"getgid\",\"getgid32\",\"getgroups\",\"getgroups32\",\"getitimer\",\"getpeername\",\"getpgid\",\"getpgrp\",\"getpid\",\"getppid\",\"getpriority\",\"getrandom\",\"getresgid\",\"getresgid32\",\"getresuid\",\"getresuid32\",\"getrlimit\",\"get_robust_list\",\"getrusage\",\"getsid\",\"getsockname\",\"getsockopt\",\"get_thread_area\",\"gettid\",\"gettimeofday\",\"getuid\",\"getuid32\",\"getxattr\",\"getxattrat\",\"inotify_add_watch\",\"inotify_init\",\"inotify_init1\",\"inotify_rm_watch\",\"io_cancel\",\"ioctl\",\"io_destroy\",\"io_getevents\",\"io_pgetevents\",\"io_pgetevents_time64\",\"ioprio_get\",\"ioprio_set\",\"io_setup\",\"io_submit\",\"ipc\",\"kill\",\"landlock_add_rule\",\"landlock_create_ruleset\",\"landlock_restrict_self\",\"lchown\",\"lchown32\",\"lgetxattr\",\"link\",\"linkat\",\"listen\",\"listmount\",\"listxattr\",\"listxattrat\",\"llistxattr\",\"_llseek\",\"lremovexattr\",\"lseek\",\"lsetxattr\",\"lstat\",\"lstat64\",\"madvise\",\"map_shadow_stack\",\"membarrier\",\"memfd_create\",\"memfd_secret\",\"mincore\",\"mkdir\",\"mkdirat\",\"mknod\",\"mknodat\",\"mlock\",\"mlock2\",\"mlockall\",\"mmap\",\"mmap2\",\"mprotect\",\"mq_getsetattr\",\"mq_notify\",\"mq_open\",\"mq_timedreceive\",\"mq_timedreceive_time64\",\"mq_timedsend\",\"mq_timedsend_time64\",\"mq_unlink\",\"mremap\",\"mseal\",\"msgctl\",\"msgget\",\"msgrcv\",\"msgsnd\",\"msync\",\"munlock\",\"munlockall\",\"munmap\",\"name_to_handle_at\",\"nanosleep\",\"newfstatat\",\"_newselect\",\"open\",\"openat\",\"openat2\",\"pause\",\"pidfd_open\",\"pidfd_send_signal\",\"pipe\",\"pipe2\",\"pkey_alloc\",\"pkey_free\",\"pkey_mprotect\",\"poll\",\"ppoll\",\"ppoll_time64\",\"prctl\",\"pread64\",\"preadv\",\"preadv2\",\"prlimit64\",\"process_mrelease\",\"pselect6\",\"pselect6_time64\",\"pwrite64\",\"pwritev\",\"pwritev2\",\"read\",\"readahead\",\"readlink\",\"readlinkat\",\"readv\",\"recv\",\"recvfrom\",\"recvmmsg\",\"recvmmsg_time64\",\"recvmsg\",\"remap_file_pages\",\"removexattr\",\"removexattrat\",\"rename\",\"renameat\",\"renameat2\",\"restart_syscall\",\"rmdir\",\"rseq\",\"rt_sigaction\",\"rt_sigpending\",\"rt_sigprocmask\",\"rt_sigqueueinfo\",\"rt_sigreturn\",\"rt_sigsuspend\",\"rt_sigtimedwait\",\"rt_sigtimedwait_time64\",\"rt_tgsigqueueinfo\",\"sched_getaffinity\",\"sched_getattr\",\"sched_getparam\",\"sched_get_priority_max\",\"sched_get_priority_min\",\"sched_getscheduler\",\"sched_rr_get_interval\",\"sched_rr_get_interval_time64\",\"sched_setaffinity\",\"sched_setattr\",\"sched_setparam\",\"sched_setscheduler\",\"sched_yield\",\"seccomp\",\"select\",\"semctl\",\"semget\",\"semop\",\"semtimedop\",\"semtimedop_time64\",\"send\",\"sendfile\",\"sendfile64\",\"sendmmsg\",\"sendmsg\",\"sendto\",\"setfsgid\",\"setfsgid32\",\"setfsuid\",\"setfsuid32\",\"setgid\",\"setgid32\",\"setgroups\",\"setgroups32\",\"setitimer\",\"setpgid\",\"setpriority\",\"setregid\",\"setregid32\",\"setresgid\",\"setresgid32\",\"setresuid\",\"setresuid32\",\"setreuid\",\"setreuid32\",\"setrlimit\",\"set_robust_list\",\"setsid\",\"setsockopt\",\"set_thread_area\",\"set_tid_address\",\"setuid\",\"setuid32\",\"setxattr\",\"setxattrat\",\"shmat\",\"shmctl\",\"shmdt\",\"shmget\",\"shutdown\",\"sigaltstack\",\"signalfd\",\"signalfd4\",\"sigprocmask\",\"sigreturn\",\"splice\",\"stat\",\"stat64\",\"statfs\",\"statfs64\",\"statmount\",\"statx\",\"symlink\",\"symlinkat\",\"sync\",\"sync_file_range\",\"syncfs\",\"sysinfo\",\"tee\",\"tgkill\",\"time\",\"timer_create\",\"timer_delete\",\"timer_getoverrun\",\"timer_gettime\",\"timer_gettime64\",\"timer_settime\",\"timer_settime64\",\"timerfd_create\",\"timerfd_gettime\",\"timerfd_gettime64\",\"timerfd_settime\",\"timerfd_settime64\",\"times\",\"tkill\",\"truncate\",\"truncate64\",\"ugetrlimit\",\"umask\",\"uname\",\"unlink\",\"unlinkat\",\"uretprobe\",\"utime\",\"utimensat\",\"utimensat_time64\",\"utimes\",\"vfork\",\"vmsplice\",\"wait4\",\"waitid\",\"waitpid\",\"write\",\"writev\",\"arm_fadvise64_64\",\"arm_sync_file_range\",\"sync_file_range2\",\"breakpoint\",\"cacheflush\",\"set_tls\"],\"action\":\"SCMP_ACT_ALLOW\"},{\"names\":[\"clone\"],\"action\":\"SCMP_ACT_ALLOW\",\"args\":[{\"index\":0,\"value\":2114060288,\"op\":\"SCMP_CMP_MASKED_EQ\"}],\"excludes\":{\"caps\":[\"CAP_SYS_ADMIN\"]}},{\"names\":[\"clone3\"],\"action\":\"SCMP_ACT_ERRNO\",\"errnoRet\":38,\"excludes\":{\"caps\":[\"CAP_SYS_ADMIN\"]}}]}"],"init_enabled":true,"init_implementation":"docker-init","init_version":"de40ad0","pid_limit":16,"memory_bytes":268435456,"memory_swap_bytes":268435456,"cpu_quota_nanos":500000000,"tmpfs":{"/tmp":"rw,nosuid,nodev,noexec,size=8388608,mode=0700,uid=65534,gid=65534","/workspace":"rw,nosuid,nodev,size=67108864,mode=0700,uid=65534,gid=65534"},"ulimits":{"fsize":838860